{
  "blocking_issues": [],
  "candidate_id": "spliced_blc0001020304050607_guppi_57752_83716_HIP99427_0035.gpuspec.0002",
  "config_version": "scoring_v0",
  "disclaimer": "This is an unconfirmed candidate/anomaly generated by a citizen-science search pipeline. It is not evidence of a confirmed technosignature. Further review and independent validation are required.",
  "false_positive_discussion": "The v0 scorer estimates a false-positive probability of 0.016. The packet records 3 negative evidence item(s) and 0 blocking issue(s). These must be resolved or explicitly accepted before any external follow-up.",
  "features": {
    "bandwidth_hz": 2.79,
    "data_quality_score": 1.0,
    "drift_rate_hz_per_sec": -5.214355,
    "frequency_hz": 1555758476.0,
    "frequency_persistence_score": 0.0,
    "hit_count": 35,
    "injection_recovery_score": 0.5,
    "instrumental_artifact_score": 0.0,
    "metadata_completeness_score": 1.0,
    "nearby_target_recurrence_score": 0.0,
    "off_hit_count": 0,
    "off_target_presence_score": 0.0,
    "on_hit_count": 35,
    "on_target_presence_score": 1.0,
    "provenance_completeness_score": 0.6,
    "repeat_observation_score": 0.0,
    "rfi_band_overlap_score": 0.0,
    "rfi_database_match_count": 0,
    "rfi_database_match_ids": "",
    "rfi_database_overlap_score": 0.0,
    "rfi_database_record_count": 5,
    "rfi_database_reviewed_count": 3,
    "rfi_database_schema_version": "rfi_database_v1",
    "rfi_database_source_classes": "",
    "rfi_database_validation_ok": true,
    "snr": 139.868637
  },
  "negative_evidence": [
    "Drift is zero or too small to help reject local interference.",
    "Independent repeat or injection-recovery support is not strong.",
    "No strong repeat observation support is present."
  ],
  "positive_evidence": [
    "High synthetic SNR supports signal reality.",
    "Signal morphology is narrowband.",
    "Signal appears in ON-target scans.",
    "Signal is weak or absent in OFF-target scans."
  ],
  "posterior": {
    "catalog_or_processing_error": 0.002259,
    "human_interference": 0.005027,
    "instrumental_artifact": 0.002259,
    "known_object": 0.001303,
    "natural_source": 0.002759,
    "noise_or_low_confidence": 0.002178,
    "technosignature_interest": 0.984215
  },
  "provenance": {},
  "recommended_pathway": "candidate_review_packet",
  "schema_version": "techno_search_packet_v1",
  "scores": {
    "false_positive_probability": 0.015785,
    "followup_value": 0.988149,
    "novelty_score": 0.994973,
    "review_readiness": 0.837836,
    "signal_reality_confidence": 0.991345
  },
  "source_ids": [],
  "track": "radio"
}
